{
  "schemaVersion": "0.1",
  "claims": [
    {"id":"nvidia-overview","companyId":"nvidia","category":"company-overview","claimType":"fact","priority":"P1","title":"フルスタックのアクセラレーテッド・コンピューティング企業","statement":"NVIDIAはGPU、CPU、ネットワークとソフトウェアを組み合わせたデータセンター向けアクセラレーテッド・コンピューティング基盤を提供している。","evidenceIds":["nvidia-overview-e1"],"verificationStatus":"source-linked","asOf":"2026-08-31","lastVerified":"2026-08-31","nextReview":"2027-08-31"},
    {"id":"nvidia-ai-role","companyId":"nvidia","category":"ai-infrastructure-role","claimType":"atlas-analysis","priority":"P1","title":"AIファクトリーの計算・接続層を統合","statement":"AtlasではNVIDIAを、AIファクトリーの計算、ネットワーク、基盤ソフトウェアを統合する中核プラットフォーム企業と位置付ける。","evidenceIds":["nvidia-ai-role-e1"],"verificationStatus":"source-linked","confidence":"high","asOf":"2026-08-31","lastVerified":"2026-08-31","nextReview":"2027-08-31","notes":"公式データセンター製品群を入力にしたAtlas分類。"},
    {"id":"nvidia-products","companyId":"nvidia","category":"products","claimType":"fact","priority":"P1","title":"GPU・CPU・DPU・ネットワークを展開","statement":"データセンター製品群にはBlackwell GPU、Grace CPU、BlueField DPU、Spectrum-Xネットワークが含まれる。","evidenceIds":["nvidia-products-e1"],"verificationStatus":"source-linked","asOf":"2026-08-31","lastVerified":"2026-08-31","nextReview":"2027-02-28"},
    {"id":"nvidia-value-chain","companyId":"nvidia","category":"value-chain-position","claimType":"atlas-analysis","priority":"P1","title":"半導体設計からクラスタ基盤までを担う","statement":"AtlasではNVIDIAを、先端半導体の設計とAIクラスタのシステム基盤を担い、製造は外部ファウンドリへ依存するfabless側の企業と整理する。","evidenceIds":["nvidia-value-chain-e1"],"verificationStatus":"source-linked","confidence":"high","asOf":"2026-08-31","lastVerified":"2026-08-31","nextReview":"2027-08-31","notes":"製品ページとFY2026 Form 10-Kのmanufacturing記載を入力に分類。"},
    {"id":"nvidia-networking","companyId":"nvidia","category":"technology","claimType":"fact","priority":"P2","title":"scale-up・scale-out・scale-acrossを接続","statement":"NVIDIAのネットワーク構成はNVLink、Quantum InfiniBand、Spectrum-X Ethernet、Spectrum-XGS、BlueField DPU、DOCAを組み合わせる。","evidenceIds":["nvidia-networking-e1"],"verificationStatus":"source-linked","asOf":"2026-08-31","lastVerified":"2026-08-31","nextReview":"2027-02-28"},
    {"id":"nvidia-positioning","companyId":"nvidia","category":"competitive-positioning","claimType":"company-positioning","priority":"P2","title":"統合AIプラットフォームとして説明","statement":"NVIDIAはGPU、SuperNIC、DPU、スイッチ、光技術、ソフトウェアを共同設計した統合AIプラットフォームとして自社を説明している。","evidenceIds":["nvidia-positioning-e1"],"verificationStatus":"source-linked","asOf":"2026-08-31","lastVerified":"2026-08-31","nextReview":"2027-08-31"},
    {"id":"nvidia-risks","companyId":"nvidia","category":"risks","claimType":"fact","priority":"P2","title":"製造・供給を第三者へ依存","statement":"NVIDIAは製造工程を第三者へ委託しており、供給制約や特定サプライヤーへの依存をリスクとして開示している。","evidenceIds":["nvidia-risks-e1"],"verificationStatus":"source-linked","asOf":"2026-01-25","lastVerified":"2026-08-31","nextReview":"2027-02-28"},

    {"id":"tsmc-overview","companyId":"tsmc","category":"company-overview","claimType":"fact","priority":"P1","title":"pure-play foundryモデルを確立","statement":"TSMCは顧客製品の製造に専念するpure-play foundry事業モデルを採用している。","evidenceIds":["tsmc-overview-e1"],"verificationStatus":"source-linked","asOf":"2026-08-31","lastVerified":"2026-08-31","nextReview":"2027-08-31"},
    {"id":"tsmc-ai-role","companyId":"tsmc","category":"ai-infrastructure-role","claimType":"atlas-analysis","priority":"P1","title":"AI半導体を量産へ接続する製造基盤","statement":"AtlasではTSMCを、AIアクセラレータなどの設計を先端プロセスとパッケージングで量産へ接続する製造基盤と位置付ける。","evidenceIds":["tsmc-ai-role-e1"],"verificationStatus":"source-linked","confidence":"high","asOf":"2026-08-31","lastVerified":"2026-08-31","nextReview":"2027-08-31","notes":"foundryモデルとHPC用途、3DFabric技術を入力にしたAtlas分類。"},
    {"id":"tsmc-products","companyId":"tsmc","category":"products","claimType":"fact","priority":"P1","title":"多様なプロセス技術で顧客ICを製造","statement":"TSMCはロジックを中心とする多様なプロセス技術で顧客設計のICを製造し、HPC、スマートフォン、IoT、自動車などへ供給している。","evidenceIds":["tsmc-products-e1"],"verificationStatus":"source-linked","asOf":"2025-12-31","lastVerified":"2026-08-31","nextReview":"2027-08-31"},
    {"id":"tsmc-value-chain","companyId":"tsmc","category":"value-chain-position","claimType":"atlas-analysis","priority":"P1","title":"fabless設計と最終システムの間の製造工程","statement":"AtlasではTSMCを、fabless企業の設計データをwafer fabricationとadvanced packagingへ変換する上流製造工程として整理する。","evidenceIds":["tsmc-value-chain-e1"],"verificationStatus":"source-linked","confidence":"high","asOf":"2026-08-31","lastVerified":"2026-08-31","nextReview":"2027-08-31"},
    {"id":"tsmc-technology","companyId":"tsmc","category":"technology","claimType":"company-positioning","priority":"P2","title":"3DFabricでfront-endとback-endを統合","statement":"TSMCは3DFabricを、front-endのSoICとback-endのCoWoS・InFOを組み合わせる3D silicon stackingおよびadvanced packaging技術群として説明している。","evidenceIds":["tsmc-technology-e1"],"verificationStatus":"source-linked","asOf":"2025-12-31","lastVerified":"2026-08-31","nextReview":"2027-02-28"},
    {"id":"tsmc-facilities","companyId":"tsmc","category":"manufacturing-facilities","claimType":"fact","priority":"P2","title":"台湾を中心にグローバルFabを運営","statement":"TSMCは台湾の複数GIGAFABに加え、南京、アリゾナ、日本、ワシントン、中国の製造拠点を運営している。","evidenceIds":["tsmc-facilities-e1"],"verificationStatus":"source-linked","asOf":"2025-12-31","lastVerified":"2026-08-31","nextReview":"2027-08-31"},
    {"id":"tsmc-capacity","companyId":"tsmc","category":"capacity-expansion","claimType":"fact","priority":"P2","title":"年間能力は12インチ換算1,700万枚超","statement":"TSMCは2025年の管理製造能力が年間1,700万枚超の12インチ換算waferだったと開示している。","evidenceIds":["tsmc-capacity-e1"],"verificationStatus":"source-linked","asOf":"2025-12-31","lastVerified":"2026-08-31","nextReview":"2026-11-29"},
    {"id":"tsmc-customer-market","companyId":"tsmc","category":"customer-end-market","claimType":"fact","priority":"P2","title":"HPCを含む幅広いend market","statement":"2025年は534顧客向けに12,682製品を製造し、HPC、スマートフォン、IoT、自動車、デジタル家電を含む用途をカバーした。","evidenceIds":["tsmc-customer-market-e1"],"verificationStatus":"source-linked","asOf":"2025-12-31","lastVerified":"2026-08-31","nextReview":"2027-02-28"},

    {"id":"applied-overview","companyId":"applied-materials","category":"company-overview","claimType":"fact","priority":"P1","title":"半導体・ディスプレイ製造装置企業","statement":"Applied Materialsは半導体および先端ディスプレイの製造に使われる材料工学ソリューションを提供する。","evidenceIds":["applied-overview-e1"],"verificationStatus":"source-linked","asOf":"2026-08-31","lastVerified":"2026-08-31","nextReview":"2027-08-31"},
    {"id":"applied-ai-role","companyId":"applied-materials","category":"ai-infrastructure-role","claimType":"atlas-analysis","priority":"P1","title":"AIチップの製造工程を支える装置層","statement":"AtlasではApplied Materialsを、AIチップの性能・電力効率を左右する材料形成と微細加工を担うwafer fabrication equipment企業と位置付ける。","evidenceIds":["applied-ai-role-e1"],"verificationStatus":"source-linked","confidence":"high","asOf":"2026-08-31","lastVerified":"2026-08-31","nextReview":"2027-08-31","notes":"公式semiconductor portfolioを入力にしたAtlas分類。"},
    {"id":"applied-products","companyId":"applied-materials","category":"products","claimType":"fact","priority":"P1","title":"材料の形成・除去・改質・計測を網羅","statement":"半導体向けportfolioは材料の堆積、除去、改質、分析、デバイス接続に関わる装置・技術を含む。","evidenceIds":["applied-products-e1"],"verificationStatus":"source-linked","asOf":"2026-08-31","lastVerified":"2026-08-31","nextReview":"2027-02-28"},
    {"id":"applied-value-chain","companyId":"applied-materials","category":"value-chain-position","claimType":"atlas-analysis","priority":"P1","title":"Fabの工程装置を供給","statement":"AtlasではApplied Materialsを、半導体メーカーやfoundryのFabへwafer process装置を供給する製造装置層として整理する。","evidenceIds":["applied-value-chain-e1"],"verificationStatus":"source-linked","confidence":"high","asOf":"2026-08-31","lastVerified":"2026-08-31","nextReview":"2027-08-31"},
    {"id":"applied-technology","companyId":"applied-materials","category":"technology","claimType":"company-positioning","priority":"P2","title":"複数工程を統合して材料界面を最適化","statement":"Applied MaterialsはIntegrated Materials Solutionを、複数processとmetrologyを一つのplatformで組み合わせる技術として説明している。","evidenceIds":["applied-technology-e1"],"verificationStatus":"source-linked","asOf":"2026-08-31","lastVerified":"2026-08-31","nextReview":"2027-02-28"},
    {"id":"applied-positioning","companyId":"applied-materials","category":"competitive-positioning","claimType":"company-positioning","priority":"P2","title":"幅広く接続されたportfolioを差別化要素と説明","statement":"同社は広範なprocess technologyとmetrologyを接続し、材料・構造を共同最適化できる点を差別化要素として説明している。","evidenceIds":["applied-positioning-e1"],"verificationStatus":"source-linked","asOf":"2026-08-31","lastVerified":"2026-08-31","nextReview":"2027-08-31"},
    {"id":"applied-strategy","companyId":"applied-materials","category":"strategy","claimType":"fact","priority":"P2","title":"EPIC Centerで共同開発を強化","statement":"Applied MaterialsはSilicon ValleyのEPIC Centerを通じ、顧客・大学・研究機関との装置およびprocess innovationの共同開発を進めている。","evidenceIds":["applied-strategy-e1"],"verificationStatus":"source-linked","asOf":"2026-08-31","lastVerified":"2026-08-31","nextReview":"2027-02-28"},
    {"id":"applied-risks","companyId":"applied-materials","category":"risks","claimType":"atlas-analysis","priority":"P2","title":"先端投資サイクルと顧客集中を継続確認","statement":"Atlasでは、先端Fab投資の周期性と大口顧客の設備投資変動を、装置需要を左右する主要な確認点として扱う。","evidenceIds":["applied-risks-e1"],"verificationStatus":"source-linked","confidence":"medium","asOf":"2026-08-31","lastVerified":"2026-08-31","nextReview":"2027-02-28","notes":"公式事業説明と決算資料を入力にしたAtlas確認点。"},

    {"id":"fujikura-overview","companyId":"fujikura","category":"company-overview","claimType":"fact","priority":"P1","title":"電線・光通信技術を展開する日本企業","statement":"フジクラは光通信を含む情報通信、エネルギー、電子部品などの事業を展開する。","evidenceIds":["fujikura-overview-e1"],"verificationStatus":"source-linked","asOf":"2026-03-31","lastVerified":"2026-08-31","nextReview":"2027-08-31"},